,text,label,Emotions,Emotions_Label,cluster
180,to the commenters who have done their part by masking up in the past and have gotten vaccinated saying covid is no longer their problem especially for those who wont get shots: do you think you are any better than all the antimasksers we have had since the pandemic began yes it is frustrating that many do want to be vaccinated but it doesnt mean i want them to get very ill or die let alone possibly indirectly play a role in filling up hospitals thus repeating a cycle we had last year: traumatized and burnt out medical professionals and those who do need other medical help reluctant to seek the care they need what about those with compromised immune systems who cant get shots or those of age as the nytimes covered who have family preventing them from getting vaccinated children who can then spread to adults there are so many people out there who can suffer because of the choices you make not just the choices they make for themselves its mental gymnastics the amount of faith so many politicians and people have put in the cdc is astounding how many mistakes have they made in the past year how many times have they flipflopped and kowtowed because it fits the thinking that so many want to hear trump was our president surely since he was an authority so many more should have just blindly trusted him a lot of us have mostly worn masks for over a year now a few more months if we act now cant hurt id like to think it can help,masking and distancing,"[{'label': 'annoyance', 'score': 0.5908063054084778}]",annoyance,1
181,how many times have we heard someone declare i know my rights at the top of their lungs constitutionality is big with everyone injecting his or her own interpretation of the term what so many of us are rejecting is the concept of the common good rejecting the vaccine is akin to spitting in your coworkers face in fact stating that you dont care what happens as long as you get your way infantile of course but very much in vogue in our country these days no problem rejecting something that would eventually benefit everybody too much government too much regulation too many rules to live by no authority can tell me what to do but dont forget to send me my stimulus check and by the way keep that army of young men and women ready to defend me while i catch a game and have a beer what has america come to,vaccination,"[{'label': 'neutral', 'score': 0.8012517094612122}]",neutral,1
182,as the current data show those who are vaccinated are unlikely to be infected and thus become possible spreaders of the covid virus being vaccinated is not a matter of personal privacy or any other personal anything vaccination is a matter of public health those who are not vaccinated should not be permitted to use any public facilities get over it antivaxxers believe whatever cult theories you choose to believe but keep you potentially lethal exhalations in the privacy of your own home get vaccinated or stay home,vaccination,"[{'label': 'neutral', 'score': 0.9126603603363037}]",neutral,0
183,if you are not vaccinated you are susceptible to getting covid and infecting other people including those who have been vaccinated why do you have the right to make other people ill or even die by spreading an illness that is so virulent and can cause very serious longterm side effects at the very least companies/employers should be required to know which employees are vaccinated and which are not and require workers not vaccinated to wear masks and social distance i fail to see why my right to stay alive should be superseded by your failure to vaccinate why is it not an invasion of my privacy to be forced to associate with people who may be spreading the virus and putting me at risk why is it an invasion of your privacy to require you do something that will protect yourself and the people around you especially since it is increasingly clear that the vaccines are safe and extremely effective as the is shown by the dropping numbers of cases and reduction of illness and death,vaccination,"[{'label': 'curiosity', 'score': 0.6978058218955994}]",curiosity,1
184,require new id badges to enter the company premises as of a certain date say months out that is a lot of lead time to get the new id badge you have to show proof of having completed covid vaccination this provides all who work at the company with a safer workplace when the company does this the vaccine hesitaters will jump through hoops to get vaccinated the new badge gives employees a visual reminder that they work for a company that stands for a safer workplace end of discussion and we all move on see: real id for drivers licenses and air travel,vaccination,"[{'label': 'approval', 'score': 0.5881795883178711}]",approval,0
185,"one angle that i believe has not been used a lot is the fact that people that do not get vaccinated are very selfish they are enjoying the perks of reduced transmissions and deaths enjoying the opening up but not helping doing their part
my friend did that he posted how happy he is to go back to broadway shows then i remarked that it was due to people getting vaccinated that we are opening up in nyc
i for one refuse to let people in my house who are not vaccinated all future parties will require vaccinations",vaccination,"[{'label': 'neutral', 'score': 0.5421052575111389}]",neutral,0
186,"people have a right to work in safe workplaces and to do business safely with firms which requires vaccinations of all employees vaccines like the pfizer vaccine is considered to be % not % effective in preventing covid infections albeit in less severe forms than without the vaccine even those who may suffer less may have long covid which was reported in the nytimes last month <a href=https://wwwnytimescom////health/covidpatientshealthriskslongtermhtml target=blank>https://wwwnytimescom////health/covidpatientshealthriskslongtermhtml</a> which refers to this study in nature:
<a href=https://wwwnaturecom/articles/sreferencepdf target=blank>https://wwwnaturecom/articles/sreferencepdf</a> another study from univ washington:
<a href=https://jamanetworkcom/journals/jamanetworkopen/fullarticle/ target=blank>https://jamanetworkcom/journals/jamanetworkopen/fullarticle/</a> firms need to act responsibly and insist on vaccinations for all of their employees i hope there is a list of firms that are committed to workplace and customer safety insisting that all employees become vaccinated people should not have to work for a firm even if vaccinated risking a chance of getting covid and some chance of long covid",vaccination,"[{'label': 'neutral', 'score': 0.8160067200660706}]",neutral,1
187,theres a misperception regarding how to manage a pandemic even states that slowly and responsibly reopened following guidelines did not do so expecting zero new cases the initial lockdown (flattening of the curve) was intended to prevent the breakdown of the health care system it was intended to be followed by a slow cautious deliberate reopening where spikes could occur italy spain germany are all experiencing this the virus cannot be eliminated it can only be controlled the health system except for a handful of places has not been overburdened and the death rates have continued to drop this has happened despite trump and his cronies the conventional wisdom ignores the dire mental physical and financial consequences of not reopening,lockdown,"[{'label': 'realization', 'score': 0.6697503924369812}]",realization,1
188,if you are vaccinated and basically healthy your odds of breakthrough infection are low and will almost certainly be totally asymptomatic or so mild as to make no difference moreover you are highly unlikely to spread the disease even the new variants going into a panic and reinstituting mask mandates as la county is doing undermines credibility and accomplishes nothing far better to just keep people informed and remind those who are very elderly or have compromised immune systems that even if vaccinated a mask is prudent indoors for that particular group life is not a zero risk game if my risk = low chance of an infection that i most likely will not even know i have that will do me no harm and is highly unlikely to be passed to others i am not wearing that thing on my face in degree heat period,masking and distancing,"[{'label': 'neutral', 'score': 0.9209555387496948}]",neutral,1
189,"so we are told to continue wearing masks and social distancing and in some places implementing restrictions or lockdowns...even though we were told that we should get the vaccine that its safe and effective at preventing serious illness and death so if it is so effective why the continued restrictions and if it isnt actually effective then why i am getting a new (created in under a year) experimental not fully fda approved vaccine if nothing in my life changes and i have to continue to social distance and mask (which is not healthy or normal for humans biologically wired to be social creatures) businesses have been destroyed poverty is worse mental health issues are off the charts...
and also another thing ive thought about is it my duty as a vaccinated person to give up my life and freedoms to protect a person who chooses to not get a vaccine and may possibly get covid and have a higher chance of dying perhaps there are some bleeding heart liberals who say yes its our job to protect the foolish thats nice of you but there are a lot of people who disagree including myself there are risks in everything we do i chose to take the risk of getting an unapproved vaccine even though there is a chance of developing health issues (blood clots or heart issues) i weighed it against the risks of getting covid and decided the risks seemed lower for the vaccine i have friends/family who came to the opposite conclusion people disagree get over it",vaccination,"[{'label': 'curiosity', 'score': 0.476918488740921}]",curiosity,1
190,i just dont think this is a smart strategy the goal is to get more people vaccinated if certain people (you know the type of people im talking about) hear that they have to keep wearing a mask anyway many wont get vaccinated we have less than percent vaccinated in my county will they get vaccinated the vaccines are free and widely available so i dont understand what the problem is oh wait yes i do ignorance: ignorance is the problem we have to walk on eggshells to keep from upsetting these people simply because they are too ignorant to get vaccinated variants will take root and well still be dealing with a pandemic this time next year though ive been vaccinated since early may im still too scared to go in large stores because i know that most of the people inside arent vaccinated how do you get the deep south vaccinated you tell people that college football season will be canceled if they dont get vaccinated you go on fox news and newsmax and tell these people that variants could emerge that evade the vaccine and upend college football season ive concluded that this is the only way to get through to these knuckleheads,vaccination,"[{'label': 'approval', 'score': 0.8935360908508301}]",approval,1
191,this is a problem of democracy sometimes the masses want whats stupid dangerous and selfish,,"[{'label': 'annoyance', 'score': 0.4108436107635498}]",annoyance,0
192,the employment question is being framed incorrectly an employer may create whatever conditions of employment the employer desires short of discriminating against a protected class employees or prospective employees then have every right to exercise their freedom to choose whether to work there or not,vaccination,"[{'label': 'neutral', 'score': 0.880807101726532}]",neutral,0
193,death is one thing most people are not bothered by it from covid because they sense it is rare and will only happen to someone else on the other hand there is the recovery and longterm afflictions that thousands will suffer through over weeks months and maybe the rest of their lives the media is giving us numbers please do more to show us how awful covid is for many people even though it is only killing a small percentage of us if people knew how bad covid can be for anyone then they would stop playing russian roulette and wear a mask,masking and distancing,"[{'label': 'fear', 'score': 0.43399491906166077}]",fear,0
194,people are weak they do not even have the will power to stay home for one short year john mccain spent years in a vietnamese prison camp and these americans cannot survive without going out to a restaurant or bar pathetic,lockdown,"[{'label': 'sadness', 'score': 0.984308660030365}]",sadness,0
195,jp morgan chase looked at visa credit card spending and spikes in the virus any where restaurant spending went up the virus spiked three weeks later,lockdown,"[{'label': 'neutral', 'score': 0.9384317994117737}]",neutral,0
196,yeah we had one chance to break the back of this virus if we could formulate a plan cut its lifecycle and get back to some normalcy we get what we deserve as a population,vaccination,"[{'label': 'approval', 'score': 0.8946135640144348}]",approval,0
197,britain where some twothirds of the population have received at least one dose of the pfizerbiontech or astrazeneca vaccine and just under half have received two doses is nonetheless grappling with a sharp rise in infections from the variant it is not complicated countries that talked of the pandemic being over had to face facts it may never be over just controlled that means everybody vaccinated or not has to make decisions based on epidemiological facts like continuing to wear masks indoors in public spaces social distancing and normal hand washing and getting the shots people who consider it an outrage that medical science is trying to save their lives with reasonable rules are living in a weird fantasy land if they have a heart attack would they click on a oonspiracy site for help if they are going into heart surgery would they rejoice if the surgeon said hey bro i am with you i have not bothered to scrub up and nobodys going to tell me to put on a mask when i am operating high five,vaccination,"[{'label': 'neutral', 'score': 0.7782362699508667}]",neutral,1
198,most of us have gotten the flu at times in spite of getting the yearly flu vaccinationusually because the vaccine didnt cover the latest variant or we were exposed to a large viral load in a poorly ventilated area or from a highly contagious person or place (hospital prison airplane cruise ships) its a rare year when we dont also contract at least one cold virus the corona virus causing covid is a virus it requires the same strategies used for any viruscaused disease  ie a vaccination if fortunate enough to have a vaccine barriers as needed following a risk assessment for yourself and others (masks gloves distance) and good hygiene is there a chance youll catch the virus or any virus in spite of all this yes will the corona virus causing covid act in this same way well its a virus will your chances of catching it be less yes there are vaccines for many viruses and some like the flu vaccine require yearly updates to manage the ongoing mutations the corona virus causing covid may be one of these many viral diseases we in the us dont think about are rampant and deadly in countries without access to vaccines (think measles) or health education the fact is viral diseases are not going away (influenzas the common cold viral pneumonia measles smallpox hepatitis herpes polio rabies bubonic plague ebola hanta fever etc) we only control them as best we can and just maybe like smallpox we (almost) eradicate them,vaccination,"[{'label': 'approval', 'score': 0.7719699144363403}]",approval,1
199,i see people who go to restaurants then sit there for minutes texting talking to fellow diners without masks they are not eating and maybe but only maybe drinking (a sip every minutes) it seems that tourists also seem entitled to walk to restaurants without masks which is required in our state once again this sense of entitlement and lack of a sense of community is not making it any easier to return to normal,masking and distancing,"[{'label': 'realization', 'score': 0.9740967750549316}]",realization,0
200,fully vaccinated since april...this last friday i sensed a cold coming on got tested last night and im positive this thing is still around and i fear there will be a small uptick in cases since the reopening and demasking i will start wearing masks again full time for a few more months,vaccination,"[{'label': 'fear', 'score': 0.7739483714103699}]",fear,0
201,it is actually not a tough decision at all the headline should read some companies are so stupid that they are thinking about not requiring a vaccine for employees,vaccination,"[{'label': 'disapproval', 'score': 0.8568909168243408}]",disapproval,0
202,i have not been out to a restaurant since the beginning of march my husband and i miss it greatly but we live in florida where masks are not even required when walking in our downtown area this is an area teaming with restaurants and people are even lined up at the ice cream shop hiptohip waiting to place their order it is sad that so many people here are not taking the virus seriously i also feel that our state has sent the message that we are a great alternative for people who want to get away this summer schools are also opening soon and must offer a five day school week per order of desantis alarming,masking and distancing,"[{'label': 'sadness', 'score': 0.9430510401725769}]",sadness,0
203,"i do not understand the reasoning behind those who do not want to get the vaccine what is the problem it is a health issue and will protect those who get the shots and the people they come in contact with are they being selfish or just being stubborn because they do not like being told what to do even if it is for their own good
please antivaxers explain your position",vaccination,"[{'label': 'confusion', 'score': 0.920209527015686}]",confusion,0
204,am i missing some obvious joke here new york has had outdoor dining for what over two months in pretty full swing not ideal but sufficient to get by for many (not all) and no increase in virus to speak of please all of you ask yourselves why the articles you read and the conversations you keep do not emphasize the power simple creativity has over crisis but rather accentuate failures,lockdown,"[{'label': 'curiosity', 'score': 0.954619288444519}]",curiosity,0
205,so essentially we are being asked or told to wear masks indoors because people who have not been vaccinated of their own volition are at risk the words too bad get smarter come to mind if i am not at risk because i and my family choose to be vaccinated while others did not and exercise risk behavior it is time to say enough these are adults they make choices they want to die pass it along get seriously ill this is america that is their choice we made ours they made theirs life or not goes on enough is enough we have shown the efficacy of the vaccines shown the downside offered this vaccine for free,vaccination,"[{'label': 'realization', 'score': 0.576683759689331}]",realization,1
206,there is a difference between the vaccines that the schools require and this vaccine that companies are considering requiring the vaccines the children get are usually for measles mumps rubella and polio it took and years to develop these vaccines and they for the most part provide you complete immunity from ever getting these diseases this covid vaccine is more like the flu vaccine and we have no idea if it is permanent or if we will need a booster and we dont know a whole lot about it i just think that theres a big difference and trying to compare the two is off target,vaccination,"[{'label': 'confusion', 'score': 0.968083918094635}]",confusion,1
207,vaccines should be required (absent legitimate medical excuse) even if there is a right not to be vaccinated rights do not exist in a vacuum and it must be balanced against the right of others not to be exposed and killed by stupid objections to the vaccine the latter right should win as jacobson v massachusetts long ago established vaccine objectors have a right to their personal freedom but so do i vaccine objectors may well have a right to die of covid they dont have a right to kill me though especially when the remedy is so painless the only way to persuade republicans to behave themselves is to cost them money if they dont trump long since established the republican platform plank that declares that altruism and concern for ones fellow humans are never enough to to justify any action that one doesnt like personal benefit is the only thing that matters to the gop so make their stupid decisions expensive the more expensive the better,vaccination,"[{'label': 'neutral', 'score': 0.5497955679893494}]",neutral,1
208,the company i worked for supported a major healthcare providers data and telecommunications systems all of our technicians were required to get the flu vaccination in order to enter their facilities if they refused they could not work there it was basically a condition of employment it is the same with regard to sending children to schools they must have been vaccinated for the various childhood diseases like measles etc it just makes sense ones personal choice and privacy does not override social responsibility for the good and health of the many the needs of the many outweigh the needs of the few or the one (apologies to mr spock),vaccination,"[{'label': 'neutral', 'score': 0.5072999000549316}]",neutral,1
209,this is ridiculous this is a sometimeslethal disease that has closed down the world for over a year million people in the us have already received the vaccine the overwhelming number have not had any adverse effects the people who are not vaccinating and who do not otherwise have a health or religious reason not to are standing in the way of heard immunity for our country they should be ashamed but they will not be they are trump people,vaccination,"[{'label': 'annoyance', 'score': 0.7211973071098328}]",annoyance,0
210,learn to cook i am a guy and my mother taught me when i was so this aint rocket science (i was preparing my lunch when the first reports of jfks assassination started being broadcast) let us ignore for the moment it is a very creative process cooking provides structure and planning to ones existence it is ultimately cheaper to cook for oneself (pasta meals with home made egg pasta start for about a buck a serving) also with a little effort you are in control of your calorie intake today you do not even have to buy cook booksit seems as if anyone who is so much as baked a loaf of bread has captured it on youtube name a dish prepared anywhere in the world i do not care if it is prepared with pigs ears in only in one district in datong shanxi you you will find its prep on youtube if you cannot cook for yourself your basic necessity and everyone you live with is dependent upon others think of it as freedom,,"[{'label': 'neutral', 'score': 0.9576417207717896}]",neutral,1
211,this is an irresponsible headline it gives the impression that if bars and restaurants were to reopen all the former patrons would come storming back in here in san francisco we have a very few neighborhoods that look like the picture on your story in the rest the outdoor tables sit empty even on friday or saturday night people are not staying away because the government tells them to they are staying away out of fear of the virus demand will not return until the virus is eradicated no matter what the government says,lockdown,"[{'label': 'neutral', 'score': 0.7339736819267273}]",neutral,0
212,workplace and safety demands requiring the vaccine public safety requires quarantine for those who refuse the vaccine,vaccination,"[{'label': 'neutral', 'score': 0.9948352575302124}]",neutral,0
213,again if insurance companies say they will not cover employees or those costs incurred as a result of hospitalization from covid because they who refused to get the vaccine things will change covid is not a pre existing condition initially so it would seem this is within the insurance companies rights i would support them in such an endeavor vaccines work that is the bottom line,vaccination,"[{'label': 'caring', 'score': 0.9475619792938232}]",caring,0
214,last night i learned of individuals who contracted the delta variant three had received the pfizer vaccination quite a while back all had had covid earlier on in the pandemic three of the four work together the fourth is a baby (shes doing just fine the others are feeling better) days after the first positive delta result at least one is still testing positive all were much sicker than the last bout with covid after inquiring about everyones health i asked why theres almost no discussion in the news about reinfection (theres a bit today) if reinfection is so rare why am i aware of three there are a lot of people visiting this city and traveling back to a home near you every single day so now what do we do there are a lot of letters between delta and omega...,vaccination,"[{'label': 'curiosity', 'score': 0.7397294640541077}]",curiosity,1
215,when someone dies from a vaccine that an employer required what happens then is the employer responsible if an employer requires a vaccine there is no longer any sort of informed consent on the part of the worker/patient would that push vaccine reactions and deaths into the workers comp system or will companies simply be held liable in civil courts that would be really interesting because it might finally give vaccineinjured people the opportunity to actually litigate their claims before a real court with a real judge jury rules of evidence and all legal theories on the table that has not been possible since the s thanks to federal law,vaccination,"[{'label': 'curiosity', 'score': 0.9016181230545044}]",curiosity,0
