,text,label,Emotions,Emotions_Label,cluster
190,the strategy of dangling maskless faces in front of the unvaccinated didnt work and no one who actually interacts with people who dont want to get vaccinated thought that it would all that happened is the unvaccinated who were grudgingly at least wearing masks much of the time just stopped wearing a mask now were all living a surreal version of invasion of the body snatchers where the unvaccinated and possibly infected look just like the vaccinated now even if the cdc tries to walk it back they will never again get the amount of grudging compliance they got before this was entirely predictable and preventable,vaccination,"[{'label': 'realization', 'score': 0.9025517106056213}]",realization,1
191,i have not eaten outside my house since march i miss our favorite places i dont want to sit down for a dinnerlength time anywhere because i am scared to i know that chez moi i can eat and not risk anything for me its a bit sad to know i wont patronize places we used to go to but no no yet,lockdown,"[{'label': 'fear', 'score': 0.8553513884544373}]",fear,0
192,i do not get this rush to separate vaxed from nonvaxed i got my second pfizer dose in february and have three months left on my excelsior pass who knows how available boosters are going to be in late august i would much rather be exposed a bit now to give myself an update sure i will keep masking but at this point variolation could actually help me,vaccination,"[{'label': 'confusion', 'score': 0.7817838788032532}]",confusion,0
193,republicans are mostly hurting themselves when they do not get vaccinated and do not wear masks if the delta variant breaks out in the usa republicans will be the ones hit the hardest,vaccination,"[{'label': 'sadness', 'score': 0.8652790784835815}]",sadness,0
194,i find this kind of article unhelpful have you ever been to india especially in new delhi if the noise crowds incense feci poverty etc...doesnt get you the smells will point im trying to make is how can that area go from thousands of people dying from this variant to now something hospitals can control so you ask yourself why didnt it wipe out more people why dont the doctors know more do we have a new variant every time this virus goes through masses of people that are not vaccinated if so then masks should be worn for the next five years for allergy sufferers and these variants just tell us what to expect,vaccination,"[{'label': 'curiosity', 'score': 0.9108144044876099}]",curiosity,0
195,im not wearing a mask to protect people who oppose vaccines this is natures way of removing people who are a threat to our population,vaccination,"[{'label': 'disapproval', 'score': 0.7105300426483154}]",disapproval,0
196,tx restaurants have been open since like may everyone seems to be handling it the new cases and deaths counts are completely unreliable a positive covid test is not even needed for a doctor to count the death as covid now no one trusts the numbers (except old people who are also easily fooled by phone scams internet scams etc) texas had a huge spike back when reporting rules changed re what could now count as a confirmed case again most people rolled their eyes and went about their business stay home if you are afraid restaurants in dallas are as full as they can be i saw over a dozen super old people back at the y today even they are not buying the hype,lockdown,"[{'label': 'neutral', 'score': 0.9466456770896912}]",neutral,0
197,our love of restaurants is one of the primary reasons why we are so fat now we can add covid to the consequences,lockdown,"[{'label': 'love', 'score': 0.979472815990448}]",love,0
198,i will still wear a good mask in any public store of any type until the pandemic is really actually over covid is not gone and continues to mutate: the risk is obvious,masking and distancing,"[{'label': 'approval', 'score': 0.9742022156715393}]",approval,0
199,have people forgotten the procedure masks and regular fabric masks do little to protect the person waring them n or p masks are % effective in filtering out the vapor particles on the inhale,masking and distancing,"[{'label': 'neutral', 'score': 0.9401981830596924}]",neutral,0
200,if you do not want to get a covid vaccine shot for whatever reason fine but do not expect everyone else to treat you as if you have had one and just because you do not want to get a covid vaccine shot do not expect those of us who have to stay in lockdown mode just because you do not think it is fair that those who have had a shot to be able to start enjoying things again actions (or inactions) have consequences,vaccination,"[{'label': 'approval', 'score': 0.4839399456977844}]",approval,0
201,there are only two things cdc has done about this pandemicactually done pretty much on its own not had shoved on them by moronsthat annoy me are a) foul up the initial tests and testings and b) issue that advisory about not bothering to mask up any more myself i got vaccinated months ago and im going to be avoiding crowds and air travel for a while yet and doing the twomask thing while shopping for a while yet and washing my hands a bunch eased up on some other things like wearing a mask outdoors but i dont see what the big deal is here,vaccination,"[{'label': 'realization', 'score': 0.5334943532943726}]",realization,0
202,healthcare systems require all their employees even those who do not interact with patients to get vaccinated with the flu shot this has been going on for awhile exceptions are for religious or medical reasons now that the covid vaccines are most likely going to come off emergency fda request i think more companies may require it or they may influence employees to get it,vaccination,"[{'label': 'neutral', 'score': 0.9853851199150085}]",neutral,0
203,the cdc guidance now puts the onus on each and every individual there will be blood,,"[{'label': 'neutral', 'score': 0.9953006505966187}]",neutral,0
204,if an employer offers health insurance to it employees they can treat vaccination the same as nonsmoking and offer discounts for getting vaccinated the unvaccinated are likely to cost more so it is fair to charge them more just as they do for smokers,vaccination,"[{'label': 'approval', 'score': 0.9622052311897278}]",approval,0
205,more people die each day in us from the virus than taiwan has new cases but we tell people to take off their masks the cannot dowill not do nation,masking and distancing,"[{'label': 'sadness', 'score': 0.7178523540496826}]",sadness,0
206,companies who no longer have any loyalty to their employees have no business directing their employees health care decisions my health care is not a collaborative exercise for managers who have no real concern for me or my family,,"[{'label': 'disapproval', 'score': 0.553336501121521}]",disapproval,0
207,i certainly will not work anywhere that does not require a vaccinated workforce no job is worth more than my health,vaccination,"[{'label': 'disapproval', 'score': 0.35140594840049744}]",disapproval,0
208,and we are opening schools,lockdown,"[{'label': 'curiosity', 'score': 0.8288796544075012}]",curiosity,0
209,antivaccine go live under a rock and disappear from society individuality does not include microbe rights to distribute unguarded,vaccination,"[{'label': 'neutral', 'score': 0.9798746705055237}]",neutral,0
210,they should all be togo only for the rest of the year,,"[{'label': 'neutral', 'score': 0.9887340068817139}]",neutral,0
211,science vs quackery and conspiracy theories where will the people with the power to make policy whether in the private or public arenas choose to stand,lockdown,"[{'label': 'curiosity', 'score': 0.6624397039413452}]",curiosity,0
212,might as well eat out after the government took our jobs away,lockdown,"[{'label': 'approval', 'score': 0.6922168731689453}]",approval,0
0,my best friend a cancer survivor after months indoors met family for dinner the restaurant followed all the guidelines she was exposed an employee tested positive thankfully she nor any family members contracted it almost once weekly an exposure potential is on my local news always an employee at a restaurant testing positive my favorite local restaurant sadly just permanently closed no i will not eat at a restaurant for a very long time i am still working i would love to see my best friend but i consider it too great a risk to take with her impaired immune system we are all missing our normal lives but a little sacrifice can save so many lives wear a mask keep your distance,masking and distancing,"[{'label': 'love', 'score': 0.4769006073474884}]",love,0
1,"so the rights of the vaxers matter but what about the rights of the rest of us who are vaccinated dont we have a right to not die at the hands of the vaxers do i have to die so the vaxers can have their right what about my rights too am i not human so i have no rights
do those of us who have accepted the medical advice and been vaccinated have no rights are we disposable so that vaxers can make their point why cant we have separate activities if necessary if we as a country choose to satisfy the vaxers must the rest of us die at the hands of vaxers",vaccination,"[{'label': 'curiosity', 'score': 0.9503011107444763}]",curiosity,1
2,the antivaxxers can exercise their rights to refuse and the employer can decide not to employ those who put other workers and clients in danger further someone who is charged with drunken driving may very well find that their auto insurance is cancelled likewise i think should be the case for those choosing to refuse the covid vaccine let the antivaxxer have his/her/their way but their health insurance company (or medicare/medicaid) should be allowed to cancel their healthcare coverage personal responsibility used to be the mantra of what is now the party of the former guy,vaccination,"[{'label': 'neutral', 'score': 0.9843101501464844}]",neutral,1
3,at my hospital flu vaccines are not required but if you opt not to get one you have to wear a mask the entire flu season now of course everyone is wearing a mask but someday in the future when covid prevalence is reduced maybe the non vaccinated people will continue to have to wear their masks and since covid does not seem to have a season that would means masks forever i do not see why other institutions cannot do the same no masks for the vaccinated eternal masks for the holdouts,vaccination,"[{'label': 'neutral', 'score': 0.9825295209884644}]",neutral,0
4,although my husband and i really really miss walking to town on a friday night to have dinner and ice cream this summer we agreed its not worth the risk instead i make quesadillas pizza pad thai or chinese at home and we crank up the music candlelight cocktails,lockdown,"[{'label': 'approval', 'score': 0.8422186970710754}]",approval,0
5,the cdc presumably at the urging of the biden administration for political and economic reasons really botched this one by telling vaccinated people they could go without masks at all times but providing no means of telling the vaccinated from the unvaccinated it was an invitation for all to discard masks how could you not know that the first ones to discard would be the unvaccinated who deny the virus anyway i am fully vaccinated but have never gone into a store etc where there are people i do not know it is not a big deal except for people who want to put their freedom actually ignorance on display,vaccination,"[{'label': 'neutral', 'score': 0.4545489549636841}]",neutral,1
6,there is no delicate balance private firms or any job that is requires public interactions should require vaccinations does the economy benefit from entertaining the idea of freedom the answer is no we have seen this already the proponents of this anti science thinking have already done enough damage if you do not want to protect your fellow workers stay home there are other folks who will benefit from taking your job while you entertain your perceived freedom to follow the lies and misinformation propagated by a fraud and a profiteer no jab no job,vaccination,"[{'label': 'disapproval', 'score': 0.6931880712509155}]",disapproval,0
7,the other day i was at urgent care for one thing but the doctor unexpectedly recommended a small procedure on my ear he called in a medical assistant she ended up taking twenty minutes a foot from my face talking half of the time it occurred to me late in the game to ask her whether or not she would had an opportunity to get vaccinated yes she would been offered it but no she did not like the idea of covid vaccines my first thought was yikes (but in language i cannot use here) and my second thought was that people should not work in the medical field if they do not have a modicum of belief in medical science it is a special kind of betrayal when you go in to take care of your health and are exposed to medical personnel who may unnecessarily endanger it covid vaccination must to be required of everyone working in a medical setting if not now then postfda approval at the latest,vaccination,"[{'label': 'realization', 'score': 0.5067425966262817}]",realization,1
8,it is irresponsible to ask people to wear masks after they have been vaccinated the simple reason is that nobody is going to do it anyway people have done what they can do and they can do no more we are not going to wear masks the rest of our lives it is time to open up and go back to normal and those who have not been vaccinated need to bet vaccinated or be at risk to a below get real there is a small risk any person could die from the behavior of some dude in the outback that passes some undetectable pathogen that effects only maybe people in the world due to a genetic predisposition should we all cower in our homes and wear hazmat suits because there is a small risk it is ridiculous somebody needs to put the foot down and shock us back into the reality that all life carries risk everyone is at risk of dying every single day that is life,vaccination,"[{'label': 'annoyance', 'score': 0.7189807891845703}]",annoyance,1
9,this medical privacy thing is out of control employers have the right to require employees be vaccinated and we customers have the right to know if we are shopping/eating at an establishment where all employees have been vaccinated,vaccination,"[{'label': 'disapproval', 'score': 0.5175302028656006}]",disapproval,0
10,no worries president trump stated last night that schools will reopen on nov because the decision to close schools is political i am certain that restaurants and bars have fallen prey to the same sinister politicians and on nov all will be well,lockdown,"[{'label': 'caring', 'score': 0.5848426818847656}]",caring,0
11,what if smallpox and polio came roaring back one day would we sit back and lamely let people choose to infect others no we would require vaccinations we should do so for covid as well,vaccination,"[{'label': 'curiosity', 'score': 0.9180696606636047}]",curiosity,0
12,thing is it is not a delicate decision it is a health screening we tell people with colds to stay home rather than infect the workplace i get companies are worried about the push back from the antivax contingent but the lawsuits against employers who do not require vaccinations will be worse,vaccination,"[{'label': 'disgust', 'score': 0.5856351852416992}]",disgust,0
13,gee thanks antivaxxers thanks all you not an antivaxxer but just want to wait folks if everyone had gotten their vaccine when it was available to them this would not be an issue now,vaccination,"[{'label': 'gratitude', 'score': 0.9967159032821655}]",gratitude,0
14,we are experiencing a pandemic give me big brother for this one piece of health information until the crisis is over i work closely with a small number of other employees in food service i would like to be able to minimize my risks,,"[{'label': 'desire', 'score': 0.634800136089325}]",desire,0
15,i did not get vaccinated just so i could stop wearing a mask though that would ultimately be nice i got vaccinated to protect the health of my loved ones myself and other people who would be at great risk from this virus i got vaccinated so we could do the things we love againhug and socialize and linger in book stores i got vaccinated to help end this pandemic that has killed so many and damaged economies around the world if i need to wear a mask indoors awhile longer because of a more infectious variant it is just not a big deal nor is it a dealbreaker for feeling like we are getting back to normal again,vaccination,"[{'label': 'caring', 'score': 0.9559553861618042}]",caring,0
16,"driven by a combination of anxiety and murky information about new virus variants some new yorkers are not letting their guard down
this is just blatantly untrue and an incredibly ungenerous and facially ludicrous summation of the reasons people are still wearing masks categorically ignoring all the valid reasons including a study of over epidemiologists published in these very pages only last week really confirms everything i already believe about the times and where it seems to be going",masking and distancing,"[{'label': 'disapproval', 'score': 0.9718937277793884}]",disapproval,0
17,just do it just put on a mask it also seems some of the anti maskers would be more appealing with a mask on,masking and distancing,"[{'label': 'approval', 'score': 0.6454333662986755}]",approval,0
18,im sitting outside at a nyc restaurant right now it is a nice night out people are enjoying the meal restaurant workers are getting a much needed paycheck the increases in covid cases was really due to very crowded indoor *bars* that masqueraded as restaurants mainly in states that never reduced their covid cases enough in states where they reduced covid cases and have introduced indoor dining like maine it hasnt been an issue at the end of the day we all need to figure out ways to restart normal activity schools work and yes restaurants while implementing precautions (masks cleaning testing) and being safe,masking and distancing,"[{'label': 'joy', 'score': 0.9217348098754883}]",joy,0
19,give them liberty and give them death,,"[{'label': 'neutral', 'score': 0.6287906765937805}]",neutral,0
20,it is about personal choice my body my choice keep your laws off my body all the fear mongering and head shaking does nothing but promote more of the same fear is control and control is power if you control those around you with fear you do not see the actions of those above you,vaccination,"[{'label': 'optimism', 'score': 0.5958130359649658}]",optimism,0
21,the supreme court ruled that an employer (hobby lobby) did not have to provide birth control because it went against the beliefs of the mains stockholders of a corporation is not this the same thing or does it sound different now that it effects men,,"[{'label': 'curiosity', 'score': 0.8146871328353882}]",curiosity,0
22,im vaccinatedbut i do understand some peoples arguments (younger liberal folks included) against immediate vaccination id say a good percentage of current unvaccinated people plan to get a jab eventually but are waiting a bit longer to see if there are any adverse results that havent been detected/reported yet we are at what percent vaccinated currently maybe in a month or two when percent is inoculated and just fine more will be persuaded of course in the meantime that increases the chances of covid variants developing putting us all back to square but i can see the concerns of not wanting to be the guinea pig for a fast tracked concoction,vaccination,"[{'label': 'curiosity', 'score': 0.8537017107009888}]",curiosity,0
23,avoiding restaurants will fatten your wallet and lighten your weight instead of the other way around,,"[{'label': 'approval', 'score': 0.8621894717216492}]",approval,0
24,to me it is simple if people want the right to decide whether or not to get vaccinated then companies should have the right to give consequences based on that decision you do not want a shot that is fine but you cannot work here and endanger other employees it is not discrimination based on any protected class of views it is a matter of public safety this petulant view that wants all the rights and none of the responsibilities is reminiscent of a spoiled adolescent,vaccination,"[{'label': 'annoyance', 'score': 0.5572571754455566}]",annoyance,0
25,i went out to dinner last night it was lovely,,"[{'label': 'joy', 'score': 0.982196569442749}]",joy,0
26,so employers can dictate what i say what i wear and require i have a certain appearance dont see why they cant require an immunization,vaccination,"[{'label': 'approval', 'score': 0.5434089303016663}]",approval,0
27,still waiting for a safe way to control airflow around maskless eating and drinking patrons till then: hon where s that recipe you pulled out for tonight,masking and distancing,"[{'label': 'curiosity', 'score': 0.851197361946106}]",curiosity,0
28,thanks to the bug ive learned to cook,lockdown,"[{'label': 'gratitude', 'score': 0.992466390132904}]",gratitude,0
29,i am curious whether any of the restaurants or anywhere else have found a meaningful number of patrons or employees with a temperature high enough to bar entry and if so was there any reluctance on the part of the patron to leave,,"[{'label': 'curiosity', 'score': 0.9953534603118896}]",curiosity,0
30,the only masks which are truly effective are ns they are medical grade and protect the wearer and those nearby the rest of the masks are minimally effective the virus particles are so tiny that they can easily evade the protection of cloth and surgical masks one might as well slap a piece of swiss cheese on ones face,masking and distancing,"[{'label': 'neutral', 'score': 0.989129900932312}]",neutral,0
31,considering that i did not even catch a cold over the past year i may never go into a public setting without a mask again just because one is vaccinated does not mean one is not crawling with microbes beside a lot of folks spit when they talk so i am no hurry for the masks to go away,vaccination,"[{'label': 'neutral', 'score': 0.9160616993904114}]",neutral,0
32,the nation wanted to live freely that is what it is about,,"[{'label': 'desire', 'score': 0.42061692476272583}]",desire,0
33,i will not be taking the risk of dining outdoors i fear that people will walk by too close without a mask i see people congregating to do outdoor dining and it is reckless and not worth the risk i understand the appeal but as a covid survivor even a mild case is no picnic,masking and distancing,"[{'label': 'disapproval', 'score': 0.47576454281806946}]",disapproval,0
34,imagine if covid killed % of those who came in contact with it there would not be any debate about mandatory vaccinations under those circumstances how low do the numbers have to go before the false dichotomy of health advocate or big brother becomes a relevant talking point we are working on dead americans here refusing to get a shot is grossly negligent every corporation in the country should mandate that both employees and customers be fully vaccinated,vaccination,"[{'label': 'disapproval', 'score': 0.45524919033050537}]",disapproval,0
35,if companies make people return to work then they must make vaccination mandatory and available we seem to have lost perspective we are in a public health emergency previously with vaccination refusal it was a case of religious beliefs not a political statement,vaccination,"[{'label': 'neutral', 'score': 0.9674931764602661}]",neutral,0
36,remember the basic evolutionary principle of survival of the fittest this aint over folks especially in the atmosphere of the ascientific nonvaxxers resumption of global travel and a world barely vaccinated nature indeed bats last,vaccination,"[{'label': 'neutral', 'score': 0.7242306470870972}]",neutral,0
37,how is vaccine requirement (or medical waiver) any more invasive of privacy than drug screening which is now widely required,vaccination,"[{'label': 'curiosity', 'score': 0.9937987923622131}]",curiosity,0
38,i am all for it being mandated for the benefit of society,masking and distancing,"[{'label': 'desire', 'score': 0.7514703869819641}]",desire,0
39,vaccines should be mandatory not only to prevent infection more importantly vaccines will prevent the virus from circulating and thus mutating to variants that may evade the vaccines so the idea that well i am vaccinated so who cares does not quite work if a private business owner who is a baker can refuse to bake cake for a gay couple then employers and companies can require vaccines if a private company can choose to prohibit health insurance coverage for contraception for its employees then it can mandate vaccines if a private company can compel drug testing for its employees then it can compel vaccines,vaccination,"[{'label': 'neutral', 'score': 0.8644707202911377}]",neutral,0
