,text,label,Emotions,Emotions_Label,cluster
103,i would be strongly against the idea of mandating these covid vaccines but i think providing incentives to get vaccinated is a good idea one reason that comes to mind for why i think it would be very irresponsible to mandate is that there is not yet any longterm safety data on these vaccines maybe there are no serious longterm side effects that will emerge or maybe the chance of serious longterm side effects is very low but at this point it is too early to know i might feel differently about mandating a vaccine after it has already been properly tested over the longterm to show that there are no serious adverse longterm side effects even then i would only support mandating under certain circumstances (ie: to travel internationally to work in certain health care professions etc),vaccination,"[{'label': 'approval', 'score': 0.754283607006073}]",approval,0
104,finally something of value come out of marketbased health care the reason i say that is because the risk in health insurance is employerbased not the individual like car insurance if employers find a vaccinated employee group yields lower group premiums they will mandate vaccination they may try incentives (lower employee contributions) or penalties (higher employee contributions) first but will resort to a jab for a job quickly colleges already are doing it i dont care if you get the vaccine because you think youre forced intimidated or pressured into doing so just get the shot,vaccination,"[{'label': 'neutral', 'score': 0.9853531718254089}]",neutral,0
105,i will not be taking the risk of dining outdoors i fear that people will walk by too close without a mask i see people congregating to do outdoor dining and it is reckless and not worth the risk i understand the appeal but as a covid survivor even a mild case is no picnic,masking and distancing,"[{'label': 'disapproval', 'score': 0.47576454281806946}]",disapproval,0
106,to me it is simple if people want the right to decide whether or not to get vaccinated then companies should have the right to give consequences based on that decision you do not want a shot that is fine but you cannot work here and endanger other employees it is not discrimination based on any protected class of views it is a matter of public safety this petulant view that wants all the rights and none of the responsibilities is reminiscent of a spoiled adolescent,vaccination,"[{'label': 'annoyance', 'score': 0.5572571754455566}]",annoyance,0
107,companies that offer subsidized group health insurance should raise their rates to cover the additional costs they will bear for employees who will cost them money by being out and potentially impaired longterm when they get ill with covid individuals who can prove they and their families have been vaccinated can get a rebate on their insurance,vaccination,"[{'label': 'neutral', 'score': 0.9259483814239502}]",neutral,0
108,the antivaxxers can exercise their rights to refuse and the employer can decide not to employ those who put other workers and clients in danger further someone who is charged with drunken driving may very well find that their auto insurance is cancelled likewise i think should be the case for those choosing to refuse the covid vaccine let the antivaxxer have his/her/their way but their health insurance company (or medicare/medicaid) should be allowed to cancel their healthcare coverage personal responsibility used to be the mantra of what is now the party of the former guy,vaccination,"[{'label': 'neutral', 'score': 0.9843101501464844}]",neutral,1
109,when i went to college i had a medical exam with a list of required vaccines and had to have a tuberculosis test as a freelancer i literally could not get an inperson booking until i got the vaccine i had my first haircut in a year and a half last weekwhen i called to make an appointment and asked about covid protocols they reassured me that the all the staff had had the vaccine my doctor still wears a mask he says that with all the variants going around he will be practicing safety protocols when i visit my dad his housekeeper drives me to the airport to make extra cash the other day she was preaching personal freedom and does not believe that masks helped and that florida was better off opening up than all the states that closed down the other day i will be taking an uber instead,masking and distancing,"[{'label': 'neutral', 'score': 0.9959182143211365}]",neutral,1
110,having been vaccinated and currently wfh but waiting to return to office i want my employer to require all employees to be vaccinated understanding the challenges of making vaccines a requirement especially since trump made masks and vaccines a political issue the alternative is to require every employee returning to the office to be vaccinated or receive negative result from a weekly approved pcr test and answer a series of daily health and social behavior questions in order to get an approved for office today moreover vaccines and weekly testing requirements should in my opinion be extended not just to return to work but to all business activities including travel and all internal/external meetings my employer is not planning to require vaccines or testing when offices reopen rather it will rely on local infection data to make decisions which are lagging statistics such an approach makes no sense to me as i believe wide spread return to office requirements without simultaneously requiring employees to be vaccinated will result in increased infections which will lead to more variants i imagine others feel like i do i do not want to return to a life of no social interaction because a breakthrough variant has made the current vaccines ineffective in my opinion anyone able but not willing to get the vaccine is unamerican selfish unsupportive of businesses and must believe a return to a mostly shutdown economy is acceptable i do not,vaccination,"[{'label': 'disapproval', 'score': 0.8700298070907593}]",disapproval,1
111,im fully vaxed and gladly don my very comfortable and well designed kn mask (with changeable filters) in most stores doesnt bother me one bit if i see someone i know ill take it off to talk provided they dont appear ill my young kids play with other young kids indoors and outdoors its a risk im willing to take because masking is robbing them of their youth and innocence at this point they need to see other kids expressions particularly a smile theyve already been scarred enough from the pandemic still dont go to crowded indoor restaurants and events but happy to sit on a patio with anybody who has their shots antivaxers really anger me im looking forward to seeing my first live concert with in the fall navigating the maze of covid safety is a little complicated at this stage my sense is by the end of the summer science will have more answers and all restrictions will be a memory but indoor masks will stick around for a while so people dont catch other respiratory illnesses not in social gatherings but in public places im neither dem nor rep but usually support the gop desantis is probably my favorite politician at the moment and i dont live in florida,masking and distancing,"[{'label': 'joy', 'score': 0.8374325633049011}]",joy,1
112,another article that totally fails to mention the vast number of restaurant workers who have not been put back on payroll despite the high amount of ppp loans awarded to establishments and business owners as a reader and former server i would appreciate a deep analysis of these statistics do the work nyt i live in la and this is the majority of people i know who make their living working in the industry they did not even get the choice,,"[{'label': 'admiration', 'score': 0.9728590846061707}]",admiration,0
113,no worries president trump stated last night that schools will reopen on nov because the decision to close schools is political i am certain that restaurants and bars have fallen prey to the same sinister politicians and on nov all will be well,lockdown,"[{'label': 'caring', 'score': 0.5848426818847656}]",caring,0
114,most of the worlds population is too young to remember smallpox and for us the vaccinations we all received as children with periodic revaccinations (every years as i recall) i read that today some smallpox virus is in a freezer in some lab in the event it might someday be usefulit is otherwise extinct on the face of the earth in todays world of nonsensical denial of facts and truth i worry that covid will remain a significant cause of illness and death for many years too many people have their own reasons to justify not getting vaccinated and our society seems to be increasingly tolerant of the rights of these nuts even if protecting their rights results in harm to others science has made significant advances in recent years but common sense is clearly on the decline,vaccination,"[{'label': 'realization', 'score': 0.461044043302536}]",realization,1
115,the only masks which are truly effective are ns they are medical grade and protect the wearer and those nearby the rest of the masks are minimally effective the virus particles are so tiny that they can easily evade the protection of cloth and surgical masks one might as well slap a piece of swiss cheese on ones face,masking and distancing,"[{'label': 'neutral', 'score': 0.989129900932312}]",neutral,0
116,i am not an anti vaxxer i was vaccinated without one hesitation or doubt i am a nurse and want to see the end of covid but i cannot help but have doubts if by any chance covid vaccine did result in some kind of birth defects if given to women of child bearing age who later bore children who would be responsible,vaccination,"[{'label': 'curiosity', 'score': 0.8735197186470032}]",curiosity,0
117,am i missing some obvious joke here new york has had outdoor dining for what over two months in pretty full swing not ideal but sufficient to get by for many (not all) and no increase in virus to speak of please all of you ask yourselves why the articles you read and the conversations you keep do not emphasize the power simple creativity has over crisis but rather accentuate failures,lockdown,"[{'label': 'curiosity', 'score': 0.954619288444519}]",curiosity,0
118,at my hospital flu vaccines are not required but if you opt not to get one you have to wear a mask the entire flu season now of course everyone is wearing a mask but someday in the future when covid prevalence is reduced maybe the non vaccinated people will continue to have to wear their masks and since covid does not seem to have a season that would means masks forever i do not see why other institutions cannot do the same no masks for the vaccinated eternal masks for the holdouts,masking and distancing,"[{'label': 'neutral', 'score': 0.9825295209884644}]",neutral,0
119,the pandemic is far from over as much as we would like it to be it is not we have all those who refused to follow basic safety protocols to thank true guidance from health authorities has at times been confusing but wearing a mask has been advised for quite a while we who wear masks and take precautions have made it possible for the no maskers anti vaxxers to go around bare faced and behave like nothing is threatening our health i do not want them to thank us i would like them to put on a mask at the very least ,masking and distancing,"[{'label': 'approval', 'score': 0.9727401733398438}]",approval,0
120,so essentially we are being asked or told to wear masks indoors because people who have not been vaccinated of their own volition are at risk the words too bad get smarter come to mind if i am not at risk because i and my family choose to be vaccinated while others did not and exercise risk behavior it is time to say enough these are adults they make choices they want to die pass it along get seriously ill this is america that is their choice we made ours they made theirs life or not goes on enough is enough we have shown the efficacy of the vaccines shown the downside offered this vaccine for free,vaccination,"[{'label': 'realization', 'score': 0.576683759689331}]",realization,1
121,my sister works for a large corporation who recently said to all the employees that the vaccine would not be required however if they did not get the vaccine they must bring in a negative covid test at the start of each work week further the employee was responsible for the cost of those tests so you do not want the vaccine fine but you are still going to offer some level of protection to the rest of the employees this seems fair to me,vaccination,"[{'label': 'approval', 'score': 0.9805207252502441}]",approval,1
122,the us strategy is to allow the virus to run through the population is that the price of freedom,,"[{'label': 'curiosity', 'score': 0.8901918530464172}]",curiosity,0
123,imagine if covid killed % of those who came in contact with it there would not be any debate about mandatory vaccinations under those circumstances how low do the numbers have to go before the false dichotomy of health advocate or big brother becomes a relevant talking point we are working on dead americans here refusing to get a shot is grossly negligent every corporation in the country should mandate that both employees and customers be fully vaccinated,vaccination,"[{'label': 'disapproval', 'score': 0.45524919033050537}]",disapproval,0
124, years ago when one of our class of graduate students contracted tuberculosis all of us students faculty and staff were required to line up for tb tests they did not ask if we wanted it they did not ask if we believed in it they did not ask if we were scared of it (one faculty member passed out from needlephobia) stop treating these babies like adults tell them to get vaccinated or find another job,vaccination,"[{'label': 'neutral', 'score': 0.6721599102020264}]",neutral,0
125,i wasnt allowed to burn leaves in my yard because doing so would burden the health and wellbeing of my neighbors i could cite dozens of similar examples of how we all accept limitations on our freedom of behavior in order to live in a safe and wellordered society todays emphasis on privacy and individual rights has gone to extreme one that the ignores the common goodin this case the very lives of our coworkersand one spurred on by a legal industry just salivating at the thought of all those vaccinationrelated lawsuits,vaccination,"[{'label': 'neutral', 'score': 0.5752641558647156}]",neutral,0
126,"just read:
 pfizer and the german company biontech have become the first companies to apply to the us food and drug administration for full approval of their covid vaccine for use in people and older the vaccine is currently being administered to adults in america under an emergency use authorization granted in december the approval process is likely to take months it could also make it easier for companies government agencies and schools to require vaccinations the equal employment opportunity commission said in december that employers could mandate vaccination and legal experts have generally agreed so we are months away from most or all companies government agencies and schools requiring vaccinations for each individual getting vaccinated as soon as possible even under fda emergency (not full) authorization remains the right thing to do so we can collectively achieve herd immunity via vaccinations (as opposed to infections and death) as soon as possible",vaccination,"[{'label': 'approval', 'score': 0.9896405339241028}]",approval,1
127,i am tired of hearing about delicate balances and individual rights this is a pandemic folks do you understand the implications of the concept there are sectors where the safety of the people requires vaccination: airlines health care food services what if we stop requiring basic sanitary practices so not no offend anyone what if we allow crews potentially carrying covid in a flying sealed tube where no matter what you will very likely breath air cotaining the virus exhaled by a member of that crew your right to risk your life ends where the risk you assumed threatens the rest of us,vaccination,"[{'label': 'curiosity', 'score': 0.7724912762641907}]",curiosity,0
128,you should not be required to go to an office that cant verify whether the people inside are vaccinated from covid because it is highly contagious,vaccination,"[{'label': 'neutral', 'score': 0.8036144971847534}]",neutral,0
129,i think there are safe ways to eat outside spaces appropriately i have done it multiple times and will continue to do so as long as you are not sitting close to any other tables waiter is masked and you are wearing a mask when you are anywhere about your table there truly is low risk and i dont think anyone has any actual data to say otherwise like the article states there are no outbreaks attributed to eating at a restaurant outdoors indoors and crowded bars are completely different story ,masking and distancing,"[{'label': 'approval', 'score': 0.7634329795837402}]",approval,0
130,this medical privacy thing is out of control employers have the right to require employees be vaccinated and we customers have the right to know if we are shopping/eating at an establishment where all employees have been vaccinated,vaccination,"[{'label': 'disapproval', 'score': 0.5175302028656006}]",disapproval,0
131,i very much enjoy restaurants but have patronized only takeout from my favorites since february think back to your time in college how often did you go to restaurants and bars my food and drink palate has changed considerably but the local bars and affordable greasy spoon restaurants got my dollars back in those days the associated independence and freedom of choice was a rite of passage after reflecting on that time in your life tell me how much will any open college town bars/restaurants be patronized with nonsocial distancing students these days and what will be the price,lockdown,"[{'label': 'joy', 'score': 0.9613389372825623}]",joy,0
132,some observations from an elderly south floridian: first the recent surge down here now apparently easing is predominantly due to teens and millennials partying closing the bars obviously a sensible notion moved the drinkathons to private residences second all restaurants are not the same many do not serve alcoholic beverages ergo they do not attract crowds our occasional recent forays into local favorites have found them virtually empty otherwise we would not go in easy to maintain social distancing under those circumstances hard to see how long they can remain in business third mask usage in stores now seems ubiquitous a good thing i do wish the media would let their readers know a dirty little secret from the contact tracers: they focus on prolonged exposure five to fifteen minutes at close quarters it would help many feel a little more secure about their grocery shopping,lockdown,"[{'label': 'desire', 'score': 0.49252748489379883}]",desire,0
133,require new id badges to enter the company premises as of a certain date say months out that is a lot of lead time to get the new id badge you have to show proof of having completed covid vaccination this provides all who work at the company with a safer workplace when the company does this the vaccine hesitaters will jump through hoops to get vaccinated the new badge gives employees a visual reminder that they work for a company that stands for a safer workplace end of discussion and we all move on see: real id for drivers licenses and air travel,vaccination,"[{'label': 'approval', 'score': 0.5881795883178711}]",approval,0
134,just to add to the experience/approach in saskatchewan i think the comments this week of the newly installed chief medical officer of the province of ontario are worth noting in my province we now have about % of the adult population with at least one covid vaccination shot and close to % of the same population fully vaccinated with shot the pressure to speed opening up and relaxation of health measures is overwhelming but public health officials are finally being listened to by politicians (having gone through a rd wave the chief medical office said on average delta wants to go from one person to six to thirty six to two hundred fifteen in a to day cycle for all these reasons we need to be cautious we need to be prudent and we need that days [pause between phases of opening up] to understand the impact we never want to take a step backward we only want to be moving forward i received by second shot this morning and with it came a fact sheet that cautioned me to continue with distancing and mask wearing protocols,masking and distancing,"[{'label': 'approval', 'score': 0.6748988628387451}]",approval,1
135,two frustrations with the article: why not talk to companies and employees who work where the flu vaccine is already required this reads as if we have no experience with this issue secondly you write that employers worry that they will lose employees if they mandate vaccines no word about employees who will come back only if the vaccine is mandated i think the number of people who will want to work where the vaccine is mandated is high yet you completely ignored it for this article,vaccination,"[{'label': 'neutral', 'score': 0.5292375683784485}]",neutral,0
136,unvaccinated americans perpetuate covid spread and ultimately virus mutations by not shutting down the spread of the disease the fears of the vaccine can be easily and objectively disproven with scientific medical data this article talks at length about legal exposure to companies mandating vaccinations but what about the legal and medical risks for not having a mandate doesnt that imply that your organization is not taking reasonably precautions to keep you workforce safe and realistically isnt that a far larger problem i heard a lawyer speaking a few days ago he wanted to mandate vaccinations for all his staff at his firm his hr department said he would have to make accommodations for those who wouldnt comply he decided to let those staff work remotely but they would have to have a camera on them at all times during the work day im sure the recalcitrant would hate that i think its a brilliant solution within the acceptable boundaries,vaccination,"[{'label': 'admiration', 'score': 0.7902801632881165}]",admiration,1
137,we need to step back and think about why viruses such as influenza and covid are around in the first place it is natures way of strengthening a species culling the weak and the sick there is nothing like a good pandemic to naturally reduce the human carbon footprint upon the earth so let the smarter ones take the vaccine and let nature have free rein on those not so inclined to do so after all is not stronger faster smarter what we are all about anyway,vaccination,"[{'label': 'realization', 'score': 0.7568441033363342}]",realization,0
138,im vaccinatedbut i do understand some peoples arguments (younger liberal folks included) against immediate vaccination id say a good percentage of current unvaccinated people plan to get a jab eventually but are waiting a bit longer to see if there are any adverse results that havent been detected/reported yet we are at what percent vaccinated currently maybe in a month or two when percent is inoculated and just fine more will be persuaded of course in the meantime that increases the chances of covid variants developing putting us all back to square but i can see the concerns of not wanting to be the guinea pig for a fast tracked concoction,vaccination,"[{'label': 'curiosity', 'score': 0.8537017107009888}]",curiosity,0
139,there are a number of commenters who are saying that unvaccinated people can still cause vaccinated individuals to become sick with covid they really cant they may cause them to be infected mostly asymptotically and almost never with severe illness so while we should be disappointed even angry with the unvaccinated for not doing their part to reduce the spread of covid we should not fear them as vectors who will cause us (or our elderly vaccinated parents) to die and please dont invoke variants here there is mounting evidence that the vaccines approved in the us protect against variants,vaccination,"[{'label': 'fear', 'score': 0.8717848658561707}]",fear,0
140,if you are vaccinated and basically healthy your odds of breakthrough infection are low and will almost certainly be totally asymptomatic or so mild as to make no difference moreover you are highly unlikely to spread the disease even the new variants going into a panic and reinstituting mask mandates as la county is doing undermines credibility and accomplishes nothing far better to just keep people informed and remind those who are very elderly or have compromised immune systems that even if vaccinated a mask is prudent indoors for that particular group life is not a zero risk game if my risk = low chance of an infection that i most likely will not even know i have that will do me no harm and is highly unlikely to be passed to others i am not wearing that thing on my face in degree heat period,vaccination,"[{'label': 'neutral', 'score': 0.9209555387496948}]",neutral,1
141,we need to step back and review how much credence we have given the crazies the antivaxxers the big lie believers sane folks need to value what is right and ensure that society at large benefits from what is right enough coddling the crazies just because they exist in great numbers we need to get back into the drivers seat and put the crazies somewhere safe we will continue to live in pandemic times unless we all comply with sound public health measures enforced by whatever legal means we have available,vaccination,"[{'label': 'approval', 'score': 0.7258331179618835}]",approval,0
