,text,label,Emotions,Emotions_Label,cluster
0,this was predicted in the spring,,"[{'label': 'neutral', 'score': 0.9359592795372009}]",neutral,0
1,insist on vaccinations or make them stay home everyone must be vaccinated for everyone to be safe,vaccination,"[{'label': 'caring', 'score': 0.5682135224342346}]",caring,0
2,if employers can make a drug test mandatory as part of their hiring process then they can make a covid vaccine mandatory also,vaccination,"[{'label': 'neutral', 'score': 0.9972274899482727}]",neutral,0
3,dozens to hundreds of people crowding together and sitting still without masks and breathing on each other contribute to the spreading of covid i am shocked shocked,masking and distancing,"[{'label': 'surprise', 'score': 0.995550274848938}]",surprise,0
4,if people were bleeding out their eyes and ears or coughing and vomiting blood like with ebola theyd get the vaccine instead they think they can handle covid not caring about spreading to others who cant this selfishness is a failure of our nation we call ourselves a christian nation but it seems these same christians only think about themselves the opposite of their leaders teachings,vaccination,"[{'label': 'neutral', 'score': 0.9403601884841919}]",neutral,0
5,require them period all the good and decent people in a work environment should not be put in harms way because the republicans are too brainwashed to do what everyone knows needs to happen without being forced,vaccination,"[{'label': 'approval', 'score': 0.9923804998397827}]",approval,0
6,would companies be liable for litigation if a vaccinated worker gets the virus from an unvaccinated one,vaccination,"[{'label': 'curiosity', 'score': 0.9954105019569397}]",curiosity,0
7,dont tread on me one of the trump insurrectionists favorite rallying cries will be replaced by the libertyloving warning dont vaccinate me,vaccination,"[{'label': 'neutral', 'score': 0.9120509624481201}]",neutral,0
8,bars and restaurants is unwise lumping of two very different environments and behavioral sets associated with each,,"[{'label': 'neutral', 'score': 0.9804830551147461}]",neutral,0
9,i am vaccinated but it is no biggie to me to continue to wear the mask in public it is not about me but about us,vaccination,"[{'label': 'approval', 'score': 0.9129553437232971}]",approval,0
10,"two of my elderly neighbors were advised by their doctors to forgo covid vaccinations for now each has previously had a severe vaccine reaction bells palsy for one of them anaphylaxis for the other they are devastated and very much afraid of covid and desperately wanted a vaccine my spouse and i are vaccinated and along with two other neighbors we help them continue to get food and engage with the world as much as it remains safe for them to do so
our society cannot forever sequester those who cannot get vaccinated for whatever reason when the rest of us are vaccinated we need to realize that it is the unvaccinated who remain vulnerable they are not a threat but excluding them from public spaces is on par with curbs steps and narrow passageways that exclude the disabled this is the problem with mandates and with businesses or government buildings requiring proof of vaccination we can forge a better way",vaccination,"[{'label': 'realization', 'score': 0.9563753008842468}]",realization,1
11,a mask has protected me from colds and the flu for that reason alone i will continue to wear one americans will spend the entirety of the pandemic arguing about masks grow up get vaccinated wear a mask this is not over yet,vaccination,"[{'label': 'approval', 'score': 0.5778703689575195}]",approval,0
12,"i understand the legal challenges of employers requiring a vaccine that is under emergency use authorization as a condition of employment however many of the employed at this point work rather efficiently at home there should be no problem for the employers to require vaccinations as a condition to return to the office if a company is not willing to require this it should offer those who are vaccinated to stay home and work from home
the same logic should (and could) be applied for sports clubs schools universities restaurants and shops if you do not get vaccinated continue getting your groceries through amazon",vaccination,"[{'label': 'neutral', 'score': 0.9365873336791992}]",neutral,0
13,if only those who cry medical privacy could somehow keep the virus to themselves as well,,"[{'label': 'neutral', 'score': 0.9972745776176453}]",neutral,0
14,i have actually forgotten what some of my co workers look like there are a few new ppl that i have never seen their face at all even though i spend several hours per week with them even though we are all vaccinated enough already,vaccination,"[{'label': 'realization', 'score': 0.9852639436721802}]",realization,0
15,i live in florida where less than % of residents have been fully vaccinated i continue to wear a mask when i am around a lot of people enter a restaurant or other business,vaccination,"[{'label': 'approval', 'score': 0.9563129544258118}]",approval,0
16,for the countrys largest companies mandatory vaccinations would protect service workers and lower the anxiety for returning office employees it would also protect and lower the anxiety for returning customers  you know the ones whose money pays the bills the salaries and the bonuses and lower the anxiety of stockholders who may be concerned about organized or de facto boycotts of companies that wont protect employees or customers or about the impact of classaction lawsuits that may arise,vaccination,"[{'label': 'approval', 'score': 0.6633951663970947}]",approval,0
17,everyone needs to grow up and learn to cook for themselves sheesh,,"[{'label': 'caring', 'score': 0.816223680973053}]",caring,0
18,why dont insurance companies increase premiums for people who refuse the vaccines why dont hospitals/ers/doctors demand an extra cash payment on unvaccinated people in order to treat them if they choose not to buy health insurance,vaccination,"[{'label': 'curiosity', 'score': 0.914799690246582}]",curiosity,0
19,the cdc declined to comment,,"[{'label': 'curiosity', 'score': 0.8419556021690369}]",curiosity,0
20,correction: the nation didnt want to eat out again trump and his trumpers wanted to open everything up for the specific purpose of revamping the failing economy majority of americans did not go out into the restaurants nor the pubs now trump and his trumpers are insisting that schools reopenanother massive disaster on its way trump failed america americans are dying,lockdown,"[{'label': 'disappointment', 'score': 0.8221269845962524}]",disappointment,0
21,"why is ibm working with new york state on a digital passport linking a persons vaccination records to an app to show business like performance venues that may require vaccination when this has been done it is called the excelsior pass it is connected to an app
entitled nys wallet my pass includes my name date of birth expiration date and something similar to a bar code which needs to be scanned what am i missing i had to check the date of the article to see if this was written months ago",vaccination,"[{'label': 'neutral', 'score': 0.6797128319740295}]",neutral,0
22,a bar is not the same thing as a restaurant even though most of the regulations fail to make that distinction a restaurant may include a bar but many do not at bars people are usually sitting side by side next to each other and often talking loudly conditions very conducive to virus transmission in restaurants people are usually sitting at tables though the distance between tables can vary a lot i used to live in manhattan and i remember how common it was for restaurants to use banquette seating where diners in single party are seated opposite each other and adjacent to other diners on the other hand restaurants in areas where real estate is not so expensive usually but not always place diners at separate nonadjacent tables restaurants can usually accommodate rules about separation of tables though sometimes at the cost of capacity and therefore of revenue but a bar that required its patrons to observe social distancing would have a very hard time operating at all my impression is when a restaurant also has a bar the bar provides a disproportionate portion of its revenue,masking and distancing,"[{'label': 'realization', 'score': 0.6396193504333496}]",realization,1
23,i know many people who died from covid and i was all for masks and precautions all along but at this point it is simply overkill read the fine print and science to see that the risk to vaccinated individuals from delta is minute and speculative at best will we all keep wearing masks forever to avoid a tiny risk for which we do not take similar levels of precautions in any other case enough with the masks and the hype unless a real and clearcut risk and danger returns,masking and distancing,"[{'label': 'curiosity', 'score': 0.9294965863227844}]",curiosity,0
24,we have not stopped masking since becoming fully vaccinated in march this is for the same reason as our starting masking within a week of the pandemic being recognized it protects others may people have a less than robust response to the vaccine and remain vulnerable despite their best efforts there is a (small) chance of the vaccinated becoming infectious with no symptoms it would be immoral for me to take even the slightest chance with others additionally we only have hard evidence on the known variants and more will come and might be different enough to overcome the vaccine,vaccination,"[{'label': 'disapproval', 'score': 0.37486159801483154}]",disapproval,1
25,it is maddening that certain scientists and health officials make statements regarding peoples reticence towards mask wearing the science must be solely concerned with the proper thing to do to curb the virus no matter how the public might react because if there is one thing that matters it is that we must all trust in the objectivity of science and not the subjectivity of politicians business owners and numerous others this is not to say that the scientists and health care officials ought to bury their heads in the sand regarding the publics reactions on the contrary i think it was bone headed of the cdc to say that fully vaccinated people could cease wearing a mask that statement opened a door that is difficult to shut the cdc should have simply stated that fully vaccinated people were well protected then let others mayors governors etc modify any rules re mask wearing,vaccination,"[{'label': 'annoyance', 'score': 0.5113298892974854}]",annoyance,1
26,there is no delicate balance between health and privacy when it comes to virus variants that are much more contagious and deadlier those who refuse to wear masks because of no other reason than to be obstinate are essentially playing russian roulette with other peoples health and lives without repercussions when they infect others they do not face criminal charges as they should they are not held responsible for the loss of wages or medical bills to that persons household they are not held responsible for anything even though their refusal to do simple things has caused death and devastation to so many other peoples lives this is plain and simple fact not something that is debatable all countries of the world should require every person to be vaccinated in order to work in any business that puts them in contact with other employees and/or customers if you are not vaccinated you should not be allowed to travel outside of your city enter any government federal state or local building business school etc yes you have a right to decide not to be vaccinated or not to wear a mask but everyone else has a right not to become infected by you and risk permanent damage to their lungs heart or any other internal organ or dying because of your choice so yes every business should require employees to be vaccinated if you dont want to be vaccinated thats your right but dont complain about losing your job ,vaccination,"[{'label': 'approval', 'score': 0.7816489338874817}]",approval,1
27,what if percent of your work force refuses are you prepared to lay off that percent he said he asked clients or what if its someone highlevel or in a key role would you be prepared to impose consequences and then they sometimes get more nervous yes and yes,vaccination,"[{'label': 'neutral', 'score': 0.5597037672996521}]",neutral,0
28,i am not putting a mask on again unless it is required air travel medical offices etc since march i have religiously followed all the rules wearing a mask even before cdc recommendations and isolating at home for the last months weeks after having my second pfizer shot i slowly and cautiously reentered the world folks like us have sacrificed a lot of precious time with family and friends especially at my age if the antivaxxers do not get their shots and this sounds harsh but it is on them,masking and distancing,"[{'label': 'realization', 'score': 0.5902615189552307}]",realization,0
29,some restaurant patrons talk up a storm with each other or on their phones for extended periods of time while some patrons may enjoy the scene others may wish to stay away from the resulting aerosols thus restaurant owners and health authorities should consider reserving certain sections of restaurants as quiet zones especially during the busy dinning hours thus reducing the amount of aerosols restaurant patrons would otherwise unwillingly inhale,masking and distancing,"[{'label': 'joy', 'score': 0.5750470161437988}]",joy,0
30,yes true points as you say many restaurant and bar employees across the country are in their s and can carry the virus home and possibly seed household transmissions which have soared and yes epidemiologists roundly agree that indoor dining especially in bars is far more likely to spawn outbreaks than outdoor settings so what do you think is about to happen as millions of teens and young adults crowd into classrooms and dorms across the nation it is not possible to avoid the reality of what we are doing or what the consequences will surely be we have already seen it yes workers have been kept from pay and the poor suffer yes businesses are breaking down no the republican leadership will never agree to subsidize the nation until a real decline in cases comes so yes we are being forced to open schools for children and colleges are forced to open as they lack funding otherwise but it is not a secret and it is not avoidablethe illnesses and deaths about to be unleashed as this latest folly unfolds too bad too bad,lockdown,"[{'label': 'approval', 'score': 0.9405195713043213}]",approval,1
31,mask mandates are not punishment for being bad actors they are to keep us safe scientists and doctors are the messengers the anger directed at people who are reporting the facts and managing an unpredictable and mutating virus is misdirected and consequential we are all tired and fedup but refusing to wear a mask just because we already did that is at our own peril we can do this buck up wear a mask and take care of yourself and others,masking and distancing,"[{'label': 'caring', 'score': 0.785582959651947}]",caring,0
32,our countrys response to this pandemic has been woeful zero leadership,,"[{'label': 'disapproval', 'score': 0.833509087562561}]",disapproval,0
33,requiring employees to get vaxxd is effective obedience testing the hr departments must be thrilled,vaccination,"[{'label': 'approval', 'score': 0.772804856300354}]",approval,0
34,what about people who have already had the virus and have developed antibodies naturally this is just as good as having the vaccination and many scientists think it is even better as you have been exposed to the whole virus a positive antibody test should count as much as having the vaccination,vaccination,"[{'label': 'curiosity', 'score': 0.7163029909133911}]",curiosity,0
35,we are in a culture of denial and it is not just about masks the whole approach of reopening to save the economy was misguided at best deceptive at worst the whole idea of reopening while the biological problem is not under control is a recipe for disaster the govt should have taken steps to ensure that all small businesses and workers would have what they needed to get through the pandemic forcing businesses to reopen (and many were gung ho about it) is systematically euthanizing them many were barely surviving on % of their customer base precovid now they have to make it work on % or % good luck wall street wants you to go chapter so hedge funds can snatch up the commercial real estate on the cheap just like they did with the housing market in so it is no surprise the govt is letting everyone suffer (remember this is a policy choice other countries did not do this) they are doing it to benefit the corporate elite people have to unite: renters landlords small biz owners commercial property owners unite and hold govt accountable call your reps,lockdown,"[{'label': 'realization', 'score': 0.6608454585075378}]",realization,1
36,clear as mud who knew so many people wouldnt jump at the chance to get vaccinated when this thing first dropped on us its stunning and just another facet of our national dysfunction,vaccination,"[{'label': 'surprise', 'score': 0.6191716194152832}]",surprise,0
37,i do not and will not sit hours in an office space with unvaccinated people my vaccine is not % just not doing it,vaccination,"[{'label': 'disapproval', 'score': 0.9765027761459351}]",disapproval,0
38,yes americans are yearning for their farro (),,"[{'label': 'curiosity', 'score': 0.9222797155380249}]",curiosity,0
39,montana implemented a very easy and efficient federally funded vaccine roll out a triumph of socialized medicine despite its red state status still vaccinations are slowing i imagine the cynical might feel more confident getting vaccinated if the companies producing the vaccines were not looking at billion dollar profits,vaccination,"[{'label': 'approval', 'score': 0.4816604554653168}]",approval,0
40,as a vaccinated person i dont share in the glee of forcing others to get vaccinated instead pushing for more equitable and ethical access across the globe making the latest scientific studies readily available and ending the partisan blaming and shaming seem like much more effective priorities than trying to force anything  especially with no scientific evidence whatsoever to support that the forced solution will work ultimately this forcing business starts to sound like religion and not health policy based on science,vaccination,"[{'label': 'approval', 'score': 0.8683158755302429}]",approval,0
41,frankly other than those that have documented medical reasons for not getting vaccinated my patience has past tie any federal or state financial and medical benefits to getting a vaccine and the reluctant lot will line up quick enough the time for pussyfooting around this has long past we have three vaccines and some inventory that is going unused when i grew up the federal government had the right to draft us into the military and to stick shots in our arms at induction and there is surely less personal freedom now then there was then line them up inoculate them and this will be a problem of our past,vaccination,"[{'label': 'realization', 'score': 0.7505826950073242}]",realization,0
42,within hours of hearing that there are too many active covid cases for my children to go to school in person at all i see people drinking/dining inside the gym sends a yippeeback to almost pre pandemic functioning masks optional if working out vigorously i quit the gym will not eat out until my kids can go back to school we get carry out and tip very well to support local businesses we walk hike bike paddle board swim in lakes rivers the sound the ocean (the ocean with wetsuits here)we are hardly stuck inside we do airbnb online experiencescooking virtual travel tours etc i am disgusted that people do not understand that until the virus is under control we cannot have our lives back we cannot have our economy back the selfishness is astoundingand it will keep going on and on until the stupidity stopsor until we have the majority vaccinated which will be months after there is a vaccine i simply do not understand how people do not get the big picture of how this works or that our schools ever thought in the spring given how people are behaving that there was any hope school could start safely in person the people hollering about their freedom (maskless of course) are keeping everyone including themselves from getting full lives and the economy back,masking and distancing,"[{'label': 'disgust', 'score': 0.9586241245269775}]",disgust,1
43,this is a public health issue and state/fed govt should have the authority to mandate vacs unless there is a disqualifying medical condition proving vac status seems problematic some see laws requiring the presentation of any type of id as an overstep or violation of civil liberty akso i personally believe in the science and would like to chuck he mask having completed the vac process if i have proof of c vaccination should not i be allowed to do so,vaccination,"[{'label': 'curiosity', 'score': 0.3832360804080963}]",curiosity,0
44,  in ny: hoping your message applies to fellow teachers administrators staff and volunteers some major school districts in ca including those that serve large populations of poc families are good at requiring adults to provide proof of negative tb tests but refuse even to ask teachers staff et al about vaccine status let alone require vaccination these people are paid with public funds and should be required to follow public health guidance and since families are required by law to enroll their children in school they are now faced with the choice of breaking the law or sending stillvulnerable children to spend plus hours a day with adults who may not be vaccinated and who may be asymptomatically spreading ever more dangerous variants to children and coworkers and the families they go home to while it appears that statistically and so far schools havent been sources of many superspreader incidents it doesnt mean it never happens and what school employee or volunteer wants the weight of a students death or disability or that of a students family on their conscience,vaccination,"[{'label': 'optimism', 'score': 0.6863796710968018}]",optimism,1
45,outdoor dining will not be feasible come november through march or april in most of the united states,lockdown,"[{'label': 'disapproval', 'score': 0.9386770129203796}]",disapproval,0
46,these injections are not yet vaccines why is everyone going along with the claims that they are did you all sign informed consent forms for this treatment are you following vaers and some of the health advocates and medical people (mostly women) who are suffering ongoing convulsions with migraines and are incapacitated and need help with dressing and cannot drive or go places alone doctors are too frightened to attribute the damage to the injection which means limited or no insurance coverage no disability and no jobs i believe these problems will compete with the damage of covid very difficult situation but people who know their health background and have studied the literature on vaccines since aids in the s (i am vaccinated except for this onestill concerned and watching) must have the choice some people are so anaphylactic that they really cannot take the chance,vaccination,"[{'label': 'curiosity', 'score': 0.6468613743782043}]",curiosity,1
47,enough the times is rife with reports about vaccine hesitancy among disparate groups and how it is making it increasing unlikely that this country will ever reach herd immunity we have tried popup clinics mobile vans house visits outreach of all kinds incentives and bribes and yet only % of the millions of adults who are still unvaccinated have any plans to do so we are in a public health emergency not only the private sector but the government must mandate vaccination for the public health of us all now that the vaccine manufacturers are applying for full authorization there is no legal excuse not to require it and every moral reason to the government cannot allow the irresponsible ignorant members of our fractured country to continue to endanger the rest of us,vaccination,"[{'label': 'annoyance', 'score': 0.29923215508461}]",annoyance,1
48,we are in this mess because yet again republicans dont like to read or be read to trump now refuses intelligence briefings viruses are not a joke once you get one you can feel its effects to the day you die its a thing that keeps giving when ignorance rules we must demand that truth rule the day fb twitter are more powerful than any government at this time if we have laws against hate speech why cant fb and twitter just use those guide lines we all know empirically that the world is round why do we permit people who dont believe in science have such a platform we must protect this great nation against stupidly because it is easily manipulated by bad people,,"[{'label': 'realization', 'score': 0.5959049463272095}]",realization,0
49,if i am a health insurance company and i see that someone i am covering is not getting a vaccination i am upping their rates and/or dropping them entirely your insurance rates should reflect your willingness to take on risk if you are a frequent skydiver or someone who drives race cars or refuses vaccines your rates and policy options should reflect that,vaccination,"[{'label': 'neutral', 'score': 0.710787296295166}]",neutral,0
